{
  "panel_name": "finops-review",
  "panel_version": "1.0.0",
  "confidence_score": 0.85,
  "risk_level": "low",
  "compliance_score": 0.85,
  "destruction_recommended": false,
  "requires_human_approval": false,
  "policy_flags": [],
  "requires_human_review": false,
  "timestamp": "2026-02-27T12:00:00Z",
  "findings": [
    {
      "persona": "finops/finops-strategist",
      "verdict": "approve",
      "confidence": 0.85,
      "rationale": "No cost impact — changes are governance configuration only. Cloud financial management strategy alignment is maintained."
    },
    {
      "persona": "finops/resource-optimizer",
      "verdict": "approve",
      "confidence": 0.85,
      "rationale": "No new cloud resources introduced. Existing resource utilization is unaffected by governance-only changes."
    },
    {
      "persona": "finops/shutdown-decommission-analyst",
      "verdict": "approve",
      "confidence": 0.85,
      "rationale": "No resources identified for shutdown or decommission. No destructive actions recommended."
    },
    {
      "persona": "finops/savings-plan-advisor",
      "verdict": "approve",
      "confidence": 0.85,
      "rationale": "No impact on savings plan coverage or reserved capacity. No commitment changes required."
    },
    {
      "persona": "finops/cost-allocation-auditor",
      "verdict": "approve",
      "confidence": 0.85,
      "rationale": "No cost allocation impact. Tagging compliance is not affected by governance-only changes."
    }
  ],
  "aggregate_verdict": "approve",
  "execution_context": {
    "repository": "SET-Apps/ai-submodule",
    "policy_profile": "default",
    "model_version": "claude-opus-4-6",
    "triggered_by": "manual"
  }
}
