{
  "panel_name": "documentation-review",
  "panel_version": "1.0.0",
  "confidence_score": 0.91,
  "risk_level": "negligible",
  "compliance_score": 1.0,
  "policy_flags": [],
  "requires_human_review": false,
  "timestamp": "2026-02-21T18:30:00Z",
  "findings": [
    {
      "persona": "leadership/mentor",
      "verdict": "approve",
      "confidence": 0.90,
      "rationale": "Both FinOps personas follow standard format. Clear separation between Engineer (governance) and Analyst (reporting). Acronyms expanded after panel feedback."
    },
    {
      "persona": "engineering/ux-engineer",
      "verdict": "approve",
      "confidence": 0.92,
      "rationale": "Consistent format, low cognitive load. Index entry discoverable under new FinOps section."
    }
  ],
  "aggregate_verdict": "approve",
  "execution_context": {
    "repository": "SET-Apps/ai-submodule",
    "branch": "itsfwcp/6-finops-group",
    "pr_number": 15,
    "policy_profile": "default",
    "model_version": "claude-opus-4-6",
    "triggered_by": "manual"
  }
}
